{
  "entrypointHash": "fdfcd66352572015c05f69380ba0c12403b5917b06e29db333031ca133557d19",
  "errors": [],
  "exitCode": 0,
  "finishedAtUtc": "2026-08-06T08:06:52.460342Z",
  "generation": 1,
  "protocolVersion": 1,
  "runId": "9aae3f23c0e34c768b7c5c60cf008bbe",
  "schemaHash": "4bbaa61e9bf8a2e2664d3b9cf98944711aa26d5c714e911044298193f08a14cb",
  "startedAtUtc": "2026-08-06T08:06:52.442325Z",
  "status": "Completed",
  "stepId": "scene-scan.report-options",
  "taskId": "es.scene.scan",
  "taskVersion": 1,
  "workerId": "es.scene.scan.python",
  "workerType": "Python",
  "workerVersion": "0.1.0"
}
